{
  "schemaVersion": "v01-task-fixture/v0.1",
  "fixtureId": "task-duplicate-create-replay",
  "category": "duplicate",
  "requirementRefs": ["AC-01", "QA-01"],
  "principal": { "kind": "FOUNDER", "principalId": "founder:test", "authenticated": true },
  "startingSnapshot": { "taskId": "task-001", "revision": 1, "workRevision": 1, "status": "TASK_STATUS_READY" },
  "resolvedReferences": { "priorCommandId": "cmd-create-001", "sameCanonicalRequestDigest": true },
  "command": {
    "createTask": {
      "meta": { "commandId": "cmd-create-retry-001", "idempotencyKey": "create-001", "idempotencyScope": "founder:test/v01", "requestDigestSha256": "cccccccccccccccccccccccccccccccccccccccccccccccccccccccccccccccc", "issuedAt": "2026-08-23T00:00:01Z", "correlationId": "corr-001" },
      "workType": "governed_repository_change",
      "inputSnapshotId": "input-001",
      "targetScopeRef": "repo-scope-001",
      "acceptanceContractRef": { "contractId": "repository_change_acceptance", "version": "1", "sha256": "aaaaaaaaaaaaaaaaaaaaaaaaaaaaaaaaaaaaaaaaaaaaaaaaaaaaaaaaaaaaaaaa" },
      "budgetProfileRef": { "contractId": "v01-quality-budget", "version": "0.1", "sha256": "bbbbbbbbbbbbbbbbbbbbbbbbbbbbbbbbbbbbbbbbbbbbbbbbbbbbbbbbbbbbbbbb" }
    }
  },
  "expected": { "outcome": "replayed", "replayed": true, "resultingStatus": "TASK_STATUS_READY", "resultingRevision": 1, "resultingWorkRevision": 1, "businessWriteCount": 0 }
}

